{
    "name": "Tirreno-Adriatico",
    "country": "Italy",
    "category": "stage",
    "when": "March, April",
    "first_edition": "1966",
    "distance": null,
    "is_classic": null,
    "also_known_as": ["The Race of the two Seas", "La corsa dei due mari"],
    "pcs_url": "https://www.procyclingstats.com/race/tirreno-adriatico",
    "insights": null
}