{
    "name": "Tour Down Under",
    "country": "Australia",
    "category": "stage",
    "when": "January",
    "first_edition": "1999",
    "distance": null,
    "is_classic": null,
    "also_known_as": ["Santos Tour Down Under"],
    "pcs_url": "https://www.procyclingstats.com/race/tour-down-under"
}