{
    "name": "Omloop Het Nieuwsblad",
    "country": "Belgium",
    "category": "one-day",
    "when": "Late February",
    "first_edition": "1945",
    "distance": 200,
    "is_classic": "Season openers",
    "also_known_as": ["The Omloop", "The Opening Classic"],
    "pcs_url": "https://www.procyclingstats.com/race/omloop-het-nieuwsblad",
    "insights": null
}