{
    "name": "Parisâ€“Nice",
    "country": "France",
    "category": "stage",
    "when": "March",
    "first_edition": "1933",
    "distance": null,
    "is_classic": null,
    "also_known_as": ["The Race to the Sun", "La Course au Soleil"],
    "pcs_url": "https://www.procyclingstats.com/race/paris-nice",
    "insights": null
}