{
    "name": "Cadel Evans Great Ocean Road Race",
    "country": "Australia",
    "category": "one-day",
    "when": "January",
    "first_edition": "2015",
    "distance": 180,
    "is_classic": null,
    "also_known_as": [],
    "pcs_url": "https://www.procyclingstats.com/race/great-ocean-race",
    "insights": "The first race was held in 2015, as the farewell race for Cadel Evansâ€”Australia's only Tour de France winner or Road World Champion."
}