{
    "name": "Strade Bianche",
    "country": "Italy",
    "category": "one-day",
    "when": "1st or 2nd Saturday of March",
    "first_edition": "2007",
    "distance": 180,
    "is_classic": "Italian spring classics",
    "also_known_as": [],
    "pcs_url": "https://www.procyclingstats.com/race/strade-bianche",
    "insights": "Thibaut Pinot described it as 'the sixth Monument' of Classic road cycling because of its iconic parcours, difficulty and prestige. The race starts and finishes (Piazza del Campo) on Siena."
}